{
  "version": "1.0.0",
  "lang": "mr",
  "disclaimer": "ही माहिती सर्वसाधारण आहे. कृपया तुमच्या डॉक्टरांचा सल्ला घ्या.",
  "days": [
    {
      "id": "day_t1_001", "stage": "t1", "dayIndex": 1, "titleMr": "दिवस १", "disclaimerMr": "ही माहिती सर्वसाधारण आहे. कृपया तुमच्या डॉक्टरांचा सल्ला घ्या.",
      "slots": {
        "affirmation": { "id": "aff_t1_001", "type": "affirmation", "stage": "t1", "lang": "mr", "bodyMr": "मी शांत आहे, आणि माझ्या आत एक सुंदर सुरुवात होत आहे." },
        "garbhSamvad": { "id": "gs_t1_001", "type": "garbh_samvad", "stage": "t1", "lang": "mr", "titleMr": "स्वागत", "audioDurationSec": 180, "bodyMr": "माझ्या बाळा, तू आमच्या आयुष्यात येणार आहेस याचा आम्हाला मनापासून आनंद आहे. तू सुरक्षित आहेस." },
        "meditation": { "id": "med_t1_001", "type": "meditation", "stage": "t1", "lang": "mr", "audioDurationSec": 180, "bodyMr": "हळू श्वास घ्या, ४ मोजा, हळू सोडा. खांदे सैल करा.", "tags": ["breathing"] },
        "tip": { "id": "tip_t1_001", "type": "tip", "stage": "t1", "lang": "mr", "bodyMr": "दिवसभर थोडं थोडं पाणी प्या. घाई न करता विश्रांती घ्या.", "tags": ["hydration", "rest"] },
        "partnerTask": { "id": "pt_001", "type": "partner_task", "stage": "t1", "lang": "mr", "bodyMr": "आज आईला एक प्रेमळ शब्द सांगा आणि एक ग्लास पाणी द्या." }
      },
      "routine": [
        { "taskKey": "rt_breathe", "titleMr": "सकाळचे श्वसन", "deepLink": "app://calm/breathing" },
        { "taskKey": "rt_water", "titleMr": "पाणी प्या", "target": 8, "deepLink": "app://tracker/water" },
        { "taskKey": "rt_samvad", "titleMr": "गर्भसंवाद", "deepLink": "app://samvad/today" },
        { "taskKey": "rt_sleep", "titleMr": "रात्री लवकर झोप" }
      ]
    },
    {
      "id": "day_t1_002", "stage": "t1", "dayIndex": 2, "titleMr": "दिवस २", "disclaimerMr": "ही माहिती सर्वसाधारण आहे. कृपया तुमच्या डॉक्टरांचा सल्ला घ्या.",
      "slots": {
        "affirmation": { "id": "aff_t1_002", "type": "affirmation", "stage": "t1", "lang": "mr", "bodyMr": "माझं शरीर शहाणं आहे; ते बाळासाठी योग्य ते करत आहे." },
        "garbhSamvad": { "id": "gs_t1_002", "type": "garbh_samvad", "stage": "t1", "lang": "mr", "titleMr": "गुणगुणणे", "audioDurationSec": 180, "bodyMr": "बाळा, आज मी तुझ्यासाठी एक शांत गाणं गुणगुणते. तुला ते आवडेल." },
        "meditation": { "id": "med_t1_002", "type": "meditation", "stage": "t1", "lang": "mr", "audioDurationSec": 240, "bodyMr": "डोळे मिटून शरीर पायांपासून डोक्यापर्यंत सैल करा.", "tags": ["relaxation"] },
        "tip": { "id": "tip_t1_002", "type": "tip", "stage": "t1", "lang": "mr", "bodyMr": "ताजी फळं आणि घरचं हलकं जेवण घ्या. आहाराबद्दल डॉक्टर/आहारतज्ञांचा सल्ला घ्या.", "tags": ["diet"] },
        "partnerTask": { "id": "pt_002", "type": "partner_task", "stage": "t1", "lang": "mr", "bodyMr": "आज स्वयंपाकात किंवा एखाद्या कामात मदत करा." }
      },
      "routine": [
        { "taskKey": "rt_meditate", "titleMr": "सकाळचं ध्यान", "deepLink": "app://calm/meditation" },
        { "taskKey": "rt_water", "titleMr": "पाणी प्या", "target": 8, "deepLink": "app://tracker/water" },
        { "taskKey": "rt_walk", "titleMr": "हलकं चालणं" },
        { "taskKey": "rt_samvad", "titleMr": "गर्भसंवाद", "deepLink": "app://samvad/today" }
      ]
    },
    {
      "id": "day_t1_003", "stage": "t1", "dayIndex": 3, "titleMr": "दिवस ३", "disclaimerMr": "ही माहिती सर्वसाधारण आहे. कृपया तुमच्या डॉक्टरांचा सल्ला घ्या.",
      "slots": {
        "affirmation": { "id": "aff_t1_003", "type": "affirmation", "stage": "t1", "lang": "mr", "bodyMr": "प्रत्येक श्वासासोबत मी अधिक शांत होत आहे." },
        "garbhSamvad": { "id": "gs_t1_003", "type": "garbh_samvad", "stage": "t1", "lang": "mr", "titleMr": "प्रेम", "audioDurationSec": 180, "bodyMr": "बाळा, तुझ्या येण्याची आम्ही आतुरतेने वाट पाहत आहोत. आम्ही तुझ्यावर खूप प्रेम करतो." },
        "meditation": { "id": "med_t1_003", "type": "meditation", "stage": "t1", "lang": "mr", "audioDurationSec": 180, "bodyMr": "श्वासावर लक्ष — विचार आले तरी हळूच श्वासाकडे परत या.", "tags": ["breathing"] },
        "tip": { "id": "tip_t1_003", "type": "tip", "stage": "t1", "lang": "mr", "bodyMr": "थकवा वाटला तर थांबा आणि विश्रांती घ्या. स्वतःशी प्रेमळ राहा.", "tags": ["rest"] },
        "partnerTask": { "id": "pt_003", "type": "partner_task", "stage": "t1", "lang": "mr", "bodyMr": "आज आईला आवडतं शांत संगीत लावा." }
      },
      "routine": [
        { "taskKey": "rt_breathe", "titleMr": "श्वसन", "deepLink": "app://calm/breathing" },
        { "taskKey": "rt_water", "titleMr": "पाणी प्या", "target": 8, "deepLink": "app://tracker/water" },
        { "taskKey": "rt_gratitude", "titleMr": "कृतज्ञता नोंद", "deepLink": "app://journal" },
        { "taskKey": "rt_samvad", "titleMr": "गर्भसंवाद", "deepLink": "app://samvad/today" }
      ]
    },
    {
      "id": "day_t1_004", "stage": "t1", "dayIndex": 4, "titleMr": "दिवस ४", "disclaimerMr": "ही माहिती सर्वसाधारण आहे. कृपया तुमच्या डॉक्टरांचा सल्ला घ्या.",
      "slots": {
        "affirmation": { "id": "aff_t1_004", "type": "affirmation", "stage": "t1", "lang": "mr", "bodyMr": "मी एकटी नाही; माझ्या भोवती प्रेम आणि आधार आहे." },
        "garbhSamvad": { "id": "gs_t1_004", "type": "garbh_samvad", "stage": "t1", "lang": "mr", "titleMr": "ओळख", "audioDurationSec": 180, "bodyMr": "बाळा, आजचा दिवस छान आहे. मी तुझ्याशी थोडं बोलते म्हणजे आपली ओळख वाढेल." },
        "meditation": { "id": "med_t1_004", "type": "meditation", "stage": "t1", "lang": "mr", "audioDurationSec": 300, "bodyMr": "कमळासारखं मन हळू उमलू द्या; शांत राहा.", "tags": ["meditation"] },
        "tip": { "id": "tip_t1_004", "type": "tip", "stage": "t1", "lang": "mr", "bodyMr": "स्क्रीनपासून थोडा वेळ दूर राहा; मोकळी हवा घ्या.", "tags": ["wellbeing"] },
        "partnerTask": { "id": "pt_004", "type": "partner_task", "stage": "t1", "lang": "mr", "bodyMr": "आज दोघं मिळून १० मिनिटं शांत बसा." }
      },
      "routine": [
        { "taskKey": "rt_meditate", "titleMr": "ध्यान", "deepLink": "app://calm/meditation" },
        { "taskKey": "rt_water", "titleMr": "पाणी प्या", "target": 8, "deepLink": "app://tracker/water" },
        { "taskKey": "rt_walk", "titleMr": "हलकं चालणं" },
        { "taskKey": "rt_journal", "titleMr": "नोंद", "deepLink": "app://journal" }
      ]
    },
    {
      "id": "day_t1_005", "stage": "t1", "dayIndex": 5, "titleMr": "दिवस ५", "disclaimerMr": "ही माहिती सर्वसाधारण आहे. कृपया तुमच्या डॉक्टरांचा सल्ला घ्या.",
      "slots": {
        "affirmation": { "id": "aff_t1_005", "type": "affirmation", "stage": "t1", "lang": "mr", "bodyMr": "माझ्या मनातली शांती माझ्या बाळापर्यंत पोहोचते." },
        "garbhSamvad": { "id": "gs_t1_005", "type": "garbh_samvad", "stage": "t1", "lang": "mr", "titleMr": "स्वीकार", "audioDurationSec": 180, "bodyMr": "बाळा, तू जसा आहेस तसाच आम्हाला हवा आहेस. आम्ही तुझी काळजी घेऊ." },
        "meditation": { "id": "med_t1_005", "type": "meditation", "stage": "t1", "lang": "mr", "audioDurationSec": 180, "bodyMr": "दीर्घ श्वसन; प्रत्येक श्वासात 'शांती' म्हणा.", "tags": ["breathing"] },
        "tip": { "id": "tip_t1_005", "type": "tip", "stage": "t1", "lang": "mr", "bodyMr": "झोप पुरेशी घ्या; रात्री ठराविक वेळी झोपण्याचा प्रयत्न करा.", "tags": ["sleep"] },
        "partnerTask": { "id": "pt_005", "type": "partner_task", "stage": "t1", "lang": "mr", "bodyMr": "आज रात्री आईला लवकर आराम करू द्या; कामं तुम्ही सांभाळा." }
      },
      "routine": [
        { "taskKey": "rt_breathe", "titleMr": "श्वसन", "deepLink": "app://calm/breathing" },
        { "taskKey": "rt_water", "titleMr": "पाणी प्या", "target": 8, "deepLink": "app://tracker/water" },
        { "taskKey": "rt_samvad", "titleMr": "गर्भसंवाद", "deepLink": "app://samvad/today" },
        { "taskKey": "rt_sleep", "titleMr": "लवकर झोप" }
      ]
    },
    {
      "id": "day_t1_006", "stage": "t1", "dayIndex": 6, "titleMr": "दिवस ६", "disclaimerMr": "ही माहिती सर्वसाधारण आहे. कृपया तुमच्या डॉक्टरांचा सल्ला घ्या.",
      "slots": {
        "affirmation": { "id": "aff_t1_006", "type": "affirmation", "stage": "t1", "lang": "mr", "bodyMr": "मी माझ्या भावनांचा आदर करते; त्या येतात-जातात." },
        "garbhSamvad": { "id": "gs_t1_006", "type": "garbh_samvad", "stage": "t1", "lang": "mr", "titleMr": "भावना", "audioDurationSec": 180, "bodyMr": "बाळा, कधी मला थोडं वेगळं वाटतं, पण तुझ्यावरचं प्रेम कायम आहे." },
        "meditation": { "id": "med_t1_006", "type": "meditation", "stage": "t1", "lang": "mr", "audioDurationSec": 240, "bodyMr": "मन अस्वस्थ असेल तर फक्त श्वास मोजा.", "tags": ["breathing"] },
        "tip": { "id": "tip_t1_006", "type": "tip", "stage": "t1", "lang": "mr", "bodyMr": "भावना जास्त जाणवल्यास जवळच्या व्यक्तीशी बोला. सतत त्रास असेल तर डॉक्टरांना भेटा.", "tags": ["mental_health"] },
        "partnerTask": { "id": "pt_006", "type": "partner_task", "stage": "t1", "lang": "mr", "bodyMr": "आज फक्त ऐका — आईचं मन मोकळं होऊ द्या." }
      },
      "routine": [
        { "taskKey": "rt_meditate", "titleMr": "ध्यान", "deepLink": "app://calm/meditation" },
        { "taskKey": "rt_water", "titleMr": "पाणी प्या", "target": 8, "deepLink": "app://tracker/water" },
        { "taskKey": "rt_mood", "titleMr": "मन:स्थिती नोंद", "deepLink": "app://tracker/mood" },
        { "taskKey": "rt_samvad", "titleMr": "गर्भसंवाद", "deepLink": "app://samvad/today" }
      ]
    },
    {
      "id": "day_t1_007", "stage": "t1", "dayIndex": 7, "titleMr": "दिवस ७", "disclaimerMr": "ही माहिती सर्वसाधारण आहे. कृपया तुमच्या डॉक्टरांचा सल्ला घ्या.",
      "slots": {
        "affirmation": { "id": "aff_t1_007", "type": "affirmation", "stage": "t1", "lang": "mr", "bodyMr": "हा आठवडा मी कृतज्ञतेने पूर्ण करते." },
        "garbhSamvad": { "id": "gs_t1_007", "type": "garbh_samvad", "stage": "t1", "lang": "mr", "titleMr": "पहिला आठवडा", "audioDurationSec": 180, "bodyMr": "बाळा, हा आपला पहिला आठवडा एकत्र. तुझ्यासोबतचा हा प्रवास सुंदर आहे." },
        "meditation": { "id": "med_t1_007", "type": "meditation", "stage": "t1", "lang": "mr", "audioDurationSec": 300, "bodyMr": "आठवड्यातल्या तीन चांगल्या गोष्टी आठवा.", "tags": ["gratitude"] },